{
  "version": 1,
  "providers": [
    {
      "type": "solapi",
      "id": "solapi",
      "config": {
        "apiKey": "env:SOLAPI_API_KEY",
        "apiSecret": "env:SOLAPI_API_SECRET",
        "defaultFrom": "env:SOLAPI_DEFAULT_FROM",
        "kakaoPfId": "env:SOLAPI_KAKAO_PF_ID"
      }
    },
    {
      "type": "iwinv",
      "id": "iwinv",
      "config": {
        "apiKey": "env:IWINV_API_KEY",
        "baseUrl": "https://alimtalk.bizservice.iwinv.kr",
        "smsBaseUrl": "https://sms.bizservice.iwinv.kr",
        "smsApiKey": "env:IWINV_SMS_API_KEY",
        "smsAuthKey": "env:IWINV_SMS_AUTH_KEY",
        "smsCompanyId": "env:IWINV_SMS_COMPANY_ID",
        "senderNumber": "env:IWINV_SENDER_NUMBER"
      }
    },
    {
      "type": "aligo",
      "id": "aligo",
      "config": {
        "apiKey": "env:ALIGO_API_KEY",
        "userId": "env:ALIGO_USER_ID",
        "sender": "env:ALIGO_SENDER",
        "senderKey": "env:ALIGO_SENDER_KEY"
      }
    }
  ],
  "routing": {
    "defaultProviderId": "solapi",
    "strategy": "first",
    "byType": {
      "ALIMTALK": ["aligo", "iwinv", "solapi"],
      "SMS": ["solapi", "iwinv", "aligo"],
      "LMS": ["solapi", "iwinv", "aligo"],
      "MMS": ["solapi", "iwinv", "aligo"]
    }
  },
  "defaults": {
    "from": "env:K_MSG_DEFAULT_FROM",
    "sms": { "autoLmsBytes": 90 },
    "kakao": {
      "channel": "main"
    }
  },
  "aliases": {
    "kakaoChannels": {
      "main": {
        "providerId": "aligo",
        "plusId": "@your_channel",
        "senderKey": "env:ALIGO_SENDER_KEY",
        "name": "Main Channel"
      }
    }
  }
}
